{
    "name": "messages",
    "table_name": "odyssey-chat-messages-${EnvName}",
    "partition_key": {
        "name": "pk",
        "type": "STRING"
    },
    "sort_key": {
        "name": "sk",
        "type": "NUMBER"
    },
    "ttl_attribute": "ttl",
    "pitr": true,
    "billing_mode": "PAY_PER_REQUEST",
    "kms_alias": "alias/odyssey-chat-${EnvName}-messages",
    "stream": "NEW_AND_OLD_IMAGES",
    "tags": {
        "service": "odyssey",
        "domain": "chat",
        "data": "messages"
    }
}